{
  "protocolVersion": "0.2",
  "schemaVersion": "0.2",
  "observationId": "obs-resource-0001",
  "worldId": "world-demo",
  "source": "game.resource",
  "kind": "resource_ref",
  "contentType": "application/octet-stream",
  "resourceRef": {
    "uri": "game://state/actors/agent-demo",
    "mediaType": "application/octet-stream",
    "digest": "sha256:resource-demo",
    "sizeBytes": 128
  },
  "observedAt": "2026-07-28T00:00:00Z",
  "trust": "authoritative",
  "visibility": {
    "scope": "agent",
    "audienceIds": [
      "agent-demo"
    ]
  },
  "extensions": {}
}
